{
  "$schema": "./schema.json",
  "version": "1.0.0",
  "last_updated": "2026-10-16",
  "ecosystem": {
    "name": "DeveloperOS",
    "website": "https://developeros.in",
    "tools_directory": "https://tools.developeros.in",
    "github_org": "https://github.com/developerOSindia"
  },
  "tools": [
    {
      "id": "tool-json-formatter",
      "name": "JSON Formatter & Prettifier",
      "category": "Formatters & Converters",
      "short_description": "Format, prettify, sort keys, and minify JSON payloads client-side.",
      "long_description": "High-performance JSON formatter supporting custom indentation (2 or 4 spaces), key alphabetical sorting, and payload minification. Operates strictly in-memory client-side with safe length limits.",
      "parent_suite": {
        "id": "developeros-devutils",
        "name": "DeveloperOS DevUtils Suite"
      },
      "live_url": null,
      "repository_url": "https://github.com/developerOSindia/developeros-devutils",
      "seo_slug": "json-formatter",
      "framework": "Streamlit",
      "hosting_provider": "Streamlit Community Cloud",
      "availability_status": "staged_local",
      "privacy_classification": "client_side_ephemeral",
      "version": "1.0.0",
      "last_verified_date": null
    },
    {
      "id": "tool-json-validator",
      "name": "JSON Validator & Linter",
      "category": "Formatters & Converters",
      "short_description": "Validate RFC 8259 JSON syntax with precise line and column error reporting.",
      "long_description": "Strict RFC 8259 syntax checker that locates missing commas, unescaped characters, and malformed object pairs with exact line/column indicators and error highlighting.",
      "parent_suite": {
        "id": "developeros-devutils",
        "name": "DeveloperOS DevUtils Suite"
      },
      "live_url": null,
      "repository_url": "https://github.com/developerOSindia/developeros-devutils",
      "seo_slug": "json-validator",
      "framework": "Streamlit",
      "hosting_provider": "Streamlit Community Cloud",
      "availability_status": "staged_local",
      "privacy_classification": "client_side_ephemeral",
      "version": "1.0.0",
      "last_verified_date": null
    },
    {
      "id": "tool-json-csv-converter",
      "name": "JSON ↔ CSV Converter",
      "category": "Formatters & Converters",
      "short_description": "Bidirectional conversion between tabular JSON array objects and CSV data.",
      "long_description": "Convert complex tabular JSON records into CSV format with auto-detected headers, or parse CSV records into structured JSON arrays. Supports custom delimiters and quote escaping.",
      "parent_suite": {
        "id": "developeros-devutils",
        "name": "DeveloperOS DevUtils Suite"
      },
      "live_url": null,
      "repository_url": "https://github.com/developerOSindia/developeros-devutils",
      "seo_slug": "json-csv-converter",
      "framework": "Streamlit",
      "hosting_provider": "Streamlit Community Cloud",
      "availability_status": "staged_local",
      "privacy_classification": "client_side_ephemeral",
      "version": "1.0.0",
      "last_verified_date": null
    },
    {
      "id": "tool-yaml-json-converter",
      "name": "YAML ↔ JSON Converter",
      "category": "Formatters & Converters",
      "short_description": "Translate configuration files between YAML and JSON syntax with validation.",
      "long_description": "Bidirectional YAML and JSON converter designed for Kubernetes manifests, Docker Compose files, and cloud configuration payloads. Safe PyYAML parsing without arbitrary code execution.",
      "parent_suite": {
        "id": "developeros-devutils",
        "name": "DeveloperOS DevUtils Suite"
      },
      "live_url": null,
      "repository_url": "https://github.com/developerOSindia/developeros-devutils",
      "seo_slug": "yaml-json-converter",
      "framework": "Streamlit",
      "hosting_provider": "Streamlit Community Cloud",
      "availability_status": "staged_local",
      "privacy_classification": "client_side_ephemeral",
      "version": "1.0.0",
      "last_verified_date": null
    },
    {
      "id": "tool-xml-formatter",
      "name": "XML Formatter & Beautifier",
      "category": "Formatters & Converters",
      "short_description": "Format, indent, and minify XML documents with XXE security defense.",
      "long_description": "Beautify or minify raw XML payloads with configurable indentation. Features built-in XXE (XML External Entity) and entity expansion defense to protect against entity injection attacks.",
      "parent_suite": {
        "id": "developeros-devutils",
        "name": "DeveloperOS DevUtils Suite"
      },
      "live_url": null,
      "repository_url": "https://github.com/developerOSindia/developeros-devutils",
      "seo_slug": "xml-formatter",
      "framework": "Streamlit",
      "hosting_provider": "Streamlit Community Cloud",
      "availability_status": "staged_local",
      "privacy_classification": "client_side_ephemeral",
      "version": "1.0.0",
      "last_verified_date": null
    },
    {
      "id": "tool-base64-codec",
      "name": "Base64 Encoder / Decoder",
      "category": "Security & Encoders",
      "short_description": "Encode and decode standard or URL-safe Base64 strings with automatic padding.",
      "long_description": "Encodes UTF-8 strings into RFC 4648 standard Base64 or URL-safe Base64, and decodes incoming strings with automatic padding reconstruction and UTF-8 error tolerance.",
      "parent_suite": {
        "id": "developeros-devutils",
        "name": "DeveloperOS DevUtils Suite"
      },
      "live_url": null,
      "repository_url": "https://github.com/developerOSindia/developeros-devutils",
      "seo_slug": "base64-codec",
      "framework": "Streamlit",
      "hosting_provider": "Streamlit Community Cloud",
      "availability_status": "staged_local",
      "privacy_classification": "client_side_ephemeral",
      "version": "1.0.0",
      "last_verified_date": null
    },
    {
      "id": "tool-jwt-decoder",
      "name": "JWT Token Claims Decoder",
      "category": "Security & Encoders",
      "short_description": "Decode JSON Web Tokens into Header and Payload with human-readable timestamps.",
      "long_description": "Inspect JWT headers, algorithms, expiry (exp), issued-at (iat), and custom claims client-side. Explicitly notes non-cryptographic verification for security clarity.",
      "parent_suite": {
        "id": "developeros-devutils",
        "name": "DeveloperOS DevUtils Suite"
      },
      "live_url": null,
      "repository_url": "https://github.com/developerOSindia/developeros-devutils",
      "seo_slug": "jwt-decoder",
      "framework": "Streamlit",
      "hosting_provider": "Streamlit Community Cloud",
      "availability_status": "staged_local",
      "privacy_classification": "client_side_ephemeral",
      "version": "1.0.0",
      "last_verified_date": null
    },
    {
      "id": "tool-uuid-generator",
      "name": "UUID / GUID Batch Generator",
      "category": "Security & Encoders",
      "short_description": "Bulk generate cryptographically secure UUID v4 and timestamp-based UUID v1.",
      "long_description": "Generate up to 100 RFC 4122 compliant UUIDs with options for uppercase formatting, hyphens removal, and curly brace wrapping. Fast and deterministic.",
      "parent_suite": {
        "id": "developeros-devutils",
        "name": "DeveloperOS DevUtils Suite"
      },
      "live_url": null,
      "repository_url": "https://github.com/developerOSindia/developeros-devutils",
      "seo_slug": "uuid-generator",
      "framework": "Streamlit",
      "hosting_provider": "Streamlit Community Cloud",
      "availability_status": "staged_local",
      "privacy_classification": "client_side_ephemeral",
      "version": "1.0.0",
      "last_verified_date": null
    },
    {
      "id": "tool-regex-tester",
      "name": "Regular Expression Tester",
      "category": "Security & Encoders",
      "short_description": "Test regex patterns, inspect named capture groups, and preview substitutions.",
      "long_description": "Evaluate Python-compatible regular expressions in real-time. Includes capture group inspection, flag toggles (ignore case, multiline, dotall), and ReDoS character limit protections.",
      "parent_suite": {
        "id": "developeros-devutils",
        "name": "DeveloperOS DevUtils Suite"
      },
      "live_url": null,
      "repository_url": "https://github.com/developerOSindia/developeros-devutils",
      "seo_slug": "regex-tester",
      "framework": "Streamlit",
      "hosting_provider": "Streamlit Community Cloud",
      "availability_status": "staged_local",
      "privacy_classification": "client_side_ephemeral",
      "version": "1.0.0",
      "last_verified_date": null
    },
    {
      "id": "tool-cron-builder",
      "name": "Cron Expression Builder & Explainer",
      "category": "Security & Encoders",
      "short_description": "Construct standard 5-part cron schedules and decode expressions into English.",
      "long_description": "Interactive visual cron builder supporting presets (hourly, daily, weekly) and field breakdowns for minutes, hours, days, months, and weekdays with instant English schedule translation.",
      "parent_suite": {
        "id": "developeros-devutils",
        "name": "DeveloperOS DevUtils Suite"
      },
      "live_url": null,
      "repository_url": "https://github.com/developerOSindia/developeros-devutils",
      "seo_slug": "cron-builder",
      "framework": "Streamlit",
      "hosting_provider": "Streamlit Community Cloud",
      "availability_status": "staged_local",
      "privacy_classification": "client_side_ephemeral",
      "version": "1.0.0",
      "last_verified_date": null
    },
    {
      "id": "tool-unix-timestamp",
      "name": "Unix Timestamp Converter",
      "category": "Text & Inspection",